时间,点赞,评论
2022.04.14,0,@w-阿蕊
2022.04.14,0,看来大家都是快憋疯了！然后彻底解放自己
2022.04.14,0,我的未来室友我做主就好了
2022.04.14,0,想多看点这种视频，乐观 看得整个人舒服[OK]
2022.04.14,0,还没开学的大学生此时在傻乎乎的看着视频笑
2022.04.14,0,可以苦中作乐 但是别赞美苦 尤其我这低风险的封了两个学期 还要补课🙏
2022.04.14,0,都封了可不能真疯了吧
2022.04.14,0,第一个常德话吧!
2022.04.14,0,有谁是被假面骑士吸引过来笑死的。反正我是
2022.04.14,0,这个对小学生来说太幼稚了，对大学生来说刚刚好
2022.04.14,0,那个老鹰捉小鸡，是我们学校的[笑哭][笑哭]
2022.04.14,0,众所周知，一个男生的智商要比一群高
2022.04.14,0,有被温暖到[tv_点赞]
2022.04.14,0,有被温暖到[tv_点赞]
2022.04.14,0,这学校落地怎么全是人没有枪啊[doge][doge]
2022.04.14,0,阿米驴你过来看看[tv_doge]
2022.04.14,0,牛批
2022.04.14,0,封校对于我这种废宅没啥影响甚至宅着宅着都忘了封校的事[笑哭]
2022.04.14,0,什么歌
2022.04.14,0,看假面骑士进来的[妙啊]
2022.04.14,0,爱情校园公寓
2022.04.14,0,呵，我到现在还没开学[嫌弃]，在家呆的都快要有心理疾病了。
2022.04.14,0,怎么说呢，很羡慕，也想有这样的一段生活经历可惜没有机会在国内上大学。[音律联觉_哭哭]
2022.04.14,0,[热词系列_知识增加]
2022.04.14,0,好青春好快乐好神经的校园生活！
2022.04.14,0,卧槽，刷到盐师
2022.04.14,0,讲真就是现在全国都在封校，再不整点活真的要无聊透了
2022.04.14,0,奔假面骑士来的
2022.04.14,0,马上Lv5了，大哥们祝我一臂之力。
2022.04.14,0,来吉林一个月的就被封了，我这个人还比看美食视频，还喜欢做饭，但是获得了一件比机箱大一倍的冰箱，冻层不制冻，冷藏不制冷，每天看美食视频我就有了想吃人的心，可惜了室友不在，每天自己在家一个人画画（上班）啊，我想出门上班，我好想吃自助
2022.04.14,0,要是我，才不会玩那么幼稚的游戏呢，下午篮球场外面的空地有人一起丢沙包吗[干物妹！小埋_玩游戏]
2022.04.14,0,读书真是一件美事儿，真不应该辍学
2022.04.14,0,之前我们学校一堆人在操场上跳广场舞，第二天班主任发通知说不让聚集，并且不能在各个平台传播相关视频[辣眼睛]，不过和我没关系就是了
2022.04.14,0,学习通1r一门包考试
2022.04.14,0,假面骑士那个无敌了
2022.04.14,0,我寝室四人寝两个躺尸👻 一个网瘾少年[捂脸]
2022.04.14,0,能遇到一群志同道合的宿友太难了
2022.04.14,0,不懂就问，封校不上课吗
2022.04.13,0,20届的表示现在还在家上网课[呆]
2022.04.13,0,谨防友情变♂质
2022.04.13,0,封校期间，应该是出现不了这种机集会吧[思考]
2022.04.13,0,别被骗了，我在的青岛大学被封的跟蹲监狱一样，而且食堂还能吃坏肚子
2022.04.13,0,为啥我们封校男寝全变成男同了♂。
2022.04.13,0,那个假面骑士哪个学校的？
2022.04.13,0,@想不出正常人的昵称了 看到封面特别想艾特了
2022.04.13,0,唉，别人的青春
2022.04.13,0,省流：没有假面骑士，但是有奥特曼
2022.04.13,0,为什么没有搓麻将的？我跟室友天天搓麻将，各地方的玩法混着玩[OK]
2022.04.13,0,羡慕
2022.04.13,0,[萌宠狗狗_看戏]
2022.04.13,0,校园爸临
2022.04.13,0,[喜极而泣]想起那群大晚上在厕所烧烤的同学了
2022.04.13,0,最近上海疫情，变成全国疫情，对于我们卖鞋的来说，真是难啊，货发不出去[大哭][大哭][大哭]希望大家都能好好的生活着，有时候平静的生活也是一种幸福
2022.04.13,0,@赤化三体人
2022.04.13,0,再怎么样，大家曾经也都是那个天真无邪的孩子[doge]
2022.04.13,0,@小熊泡饭yoyo 里面也有帅哥
2022.04.13,0,青春16年，疫情才几年[doge][doge][doge]
2022.04.13,0,【狗头】
2022.04.13,0,有没有人整个集体跳恋舞的啊感觉还挺带感的哈哈哈哈哈哈哈
2022.04.13,0,zio-dcd装甲
2022.04.13,0,封校证明，我并不是不喜欢看广场舞，只是跳的人不对[藏狐][藏狐]
2022.04.13,0,封面龙牙，电王，月骑，甲斗，空我。[歪嘴]
2022.04.13,0,哈哈哈哈哈绝了，绝绝子
2022.04.13,0,三连了
2022.04.13,0,这很明显能接快递，有的却接不了快递
2022.04.13,0,多么美好的校园生活
2022.04.13,0,两年后我也会这么样吗[热词系列_知识增加]
2022.04.13,0,其实吧，封校也不是一件坏事，有句话怎么说的，“我的青春才几年，光疫情就占了三年”。疫情刚开始很多人刚进入大学，这眼看着该毕业了，多年后想起来，有那么一群兄弟度过了一段搞笑的二逼岁月，多有意思
2022.04.13,0,"热搜挂了好几天了吧，我真的不想点进来看，因为看到封面就会大致猜到视频内容，但是今天还是忍不住点了进来，果不其然，还是蚌埠住了，虽然没哭，但真的好触动，不为别的，只因为……我毕业了，我工作了，我不在学校了，当视频播放完毕的瞬间，又会觉得自己好孤独。

“没有人永远18岁，但永远有人18岁”，我才24岁，可是却已经开始有所怀念青春过往了啊。"
2022.04.13,0,开幕雷击
2022.04.13,0,哪来衣服？
2022.04.13,0,这是原唱还是音乐系自己制作的？
2022.04.13,0,真好啊，热闹好啊
2022.04.13,0,封校好几个月了，每次下晚自习，在漆黑的夜里总有点点灯火，还有在灯火中的若隐若现的网兜[doge]
2022.04.13,0,。。。都是抖音上的短视频
2022.04.13,0,为啥看着看着眼睛湿了
2022.04.13,0,"我们学校有人在池塘钓鱼，还叼个烟翘个二郎腿,被学部主任拍下来了，主要我还在他旁边一起被拍了，完犊子[灵魂出窍]"
2022.04.13,0,真的很羡慕啊，但我一想起我那小心眼的室友，真的是很羡慕了[酸了]
2022.04.13,0,青春不该被疫情束缚！
2022.04.13,0,[doge]
2022.04.13,0,真就憋疯了
2022.04.13,0,@呃12138 看到你们了[doge]
2022.04.13,0,"太羡慕了[酸了]我们这儿都是天天手机+电脑+摆烂[笑]
学校也小[保卫萝卜_白眼]没这么多社牛、会整活的人[保卫萝卜_哭哭]"
2022.04.13,0,研究生只能沉迷科研
2022.04.13,0,学校封了，学生们也疯了[笑哭][笑哭]
2022.04.13,0,两年前的疫情，一边上网课一边睡懒觉，真的好舒服好舒服啊，两年后的疫情，我终于大学毕业了，工作干了好几份，都是不能长久的工作。
2022.04.13,0,好开心啊
2022.04.13,0,对于小学生来说未免太过幼稚，对于大学生来说刚刚好[doge]
2022.04.13,0,我的注意力都在歌曲上[大哭]好怀念啊，以前看爱情公寓的那种感觉
2022.04.13,0,把我扔进那个全员健身的宿舍，不论我怎么叫都别救我[抱拳][抱拳]
2022.04.13,0,假面骑士
2022.04.13,0,哈哈哈哈，现在封校每天晚上都这么欢乐，没封的时候都懒得出去[狗子]
2022.04.13,0,真好
2022.04.13,0,第一个绝对是常德老乡
2022.04.13,0,看来大家都憋坏了，希望疫情早日结束[锦鲤]🍀✨💐
2022.04.13,0,@爺不死 [Cat2_OddFriend]
2022.04.13,0,封校在家，我也希望在学校啊
2022.04.13,0,哈哈哈
2022.04.13,0,人才辈出
2022.04.13,0,在家……[藏狐]
2022.04.13,0,我，大学生，一个星期25节大课，全周无修。但是说提前放假把课调周末了[笑哭]
2022.04.13,0,第一段想起阿码棕那个视频
2022.04.13,0,羡慕的大学生活
2022.04.13,0,疫情快过去吧，你看看都把孩子逼成……当我没说……[镜音铃·连_汗]
2022.04.13,0,《平  成  黑  帮  在  校  园》[妙啊]
2022.04.13,0,@富贵妮- 救命啊！
2022.04.13,0,疫情下的青春也可以很快乐，你的青春与自己的选择有关[给心心]
2022.04.13,0,@桔子and汽水
2022.04.13,0,青春！
2022.04.13,0,咱就是说我还没开学[大哭]
2022.04.13,0,老铁们，别赞了，都200多赞了，现在还有50条消息都是这个弹幕“初三在家看大学疯”。。。好无语😓
2022.04.13,0,大四了，疫情推迟返校[笑哭]，我的大学生活
2022.04.13,0,笑死，因为疫情现在还没返校
2022.04.13,0,好耶是卡面来打
2022.04.13,0,我们开学了了无期[藏狐]这大学寄了
2022.04.13,0,"快乐和幸福并不局限于某种工作、某种生活、某种物质、某件事
快乐的根本就是一个个快乐着的人
总能在平凡里找到乐子，这也很酷不是吗[打call]"
2022.04.13,0,我可以去大学宿舍隔离吗
2022.04.13,0,爱情公寓的bgm很应景 已经燃起来了！
2022.04.13,0,[泼水节]
2022.04.13,0,疫情期间聚众容易传播，这学校在哪请曝光一下
2022.04.13,0,1000人在看，看来是真的闲
2022.04.13,0,第一个好秀啊
2022.04.13,0,来打！[打call]
2022.04.13,0,[热词系列_知识增加]
2022.04.13,0,我的未来室友我做主[吃瓜]
2022.04.13,0,假面骑士抓了个妹子
2022.04.13,0,我在学校就没快乐过几次，这十几年
2022.04.13,0,视频内容你得到授权了吗
2022.04.13,0,封面呢，封面呢
2022.04.13,0,《关于1000+人和我一起看封校大学生的生活这件事》
2022.04.13,0,我的宿舍就是正常的网吧四连坐罢了[大笑]
2022.04.13,0,哈，我们学校把体育场给封了……哪来的快乐啊，开学以来天天网课我们同学都快憋出毛病了
2022.04.13,0,请问开头那个BGM是啥啊
2022.04.13,0,人不可能一直天真的吧
2022.04.13,0,看到逼王就啪一下点进来了
2022.04.13,0,讲道理，有这样的朋友一起疯一起搞笑可真羡慕[酸了]
2022.04.13,0,年轻真好
2022.04.13,0,你们封校，我这封寝[委屈]谢谢，已经疯了
2022.04.13,0,我要封面
2022.04.13,0,千手一族都我帮你打破419和420的评论
2022.04.13,0,快让疫情滚啊！都几年了！来自20高考毕业生
2022.04.13,0,发弹幕的初三高三别被骗了，封校的大学真没这么快乐[大哭]
2022.04.13,0,好欢乐好青春呀，我这个社畜都看哭了
2022.04.13,0,那个广场舞的好像是咱广埠屯女子大学？？[doge]
2022.04.13,0,不用上课吗？
2022.04.13,0,快乐归快乐，我还是想家
2022.04.13,0,有的甚至30℃开不了空调
2022.04.13,0,上海大学生哭了
2022.04.13,0,40秒的那个叫什么呀，小时候超爱玩
2022.04.13,0,好羡慕啊，只能说欢乐都是别的学校的[酸了]
2022.04.13,0,我就只想看看假面骑士
2022.04.13,0,看到封面才进来的，为什么没有封面的[藏狐]
2022.04.13,0,r
2022.04.13,0,作业不够多啊
2022.04.13,0,都好快乐呀！我也想去和同学一起到校园操场玩耍，但作为一个大四狗我太懒了又不想动
2022.04.13,0,已经封校了还能这种活动的，看来该封到寝室了
2022.04.13,0,[热词系列_爱了爱了]
2022.04.13,0,减少大范围聚集好吗，你怎么知道跟你跳广场舞的没有晚上翻墙出去蹦迪的？
2022.04.13,0,好的大学是快乐的基础，学校基础建设良好，福利也好，那时候疯玩的也会有底气，不是吗[鼓掌]。好好学习吧，今年我高二，每天晚上学到凌晨一点，没什么梦想，只想去大学看看，是否像父母说的那样美好。加油吧，让我们拿起笔，开始刷五三[墨镜]
2022.04.13,0,在外实习，酒店隔离，没人陪着玩[大哭]
2022.04.13,0,@乌拉波波沙
2022.04.13,0,要是有一例全都没了[吃瓜]
2022.04.13,0,优秀呀
2022.04.13,0,四大才子绷不住了
2022.04.13,0,窝家里两个月了
2022.04.13,0,可是不封比这还多彩怎么不说
2022.04.13,0,我只想看假面骑士
2022.04.13,0,这一届老了要学的广场舞有很多啊。
2022.04.13,0,第一个太危险了，万一他不想吃饭想休息怎么办。。。，。，
2022.04.13,0,视频和配乐几个意思？ 我的未来室友我做主？[doge]
2022.04.13,0,"中午我去食堂，你们谁去？，，，，，
没人去，是吧，那我自己去了啊！！[doge][doge][doge]"
2022.04.13,0,考研人遇上封校，是学也学不痛快，玩还不敢玩[tv_笑哭]
2022.04.13,0,@箱某人 [doge]
2022.04.13,0,不是假面骑士呢，看完都没看到
2022.04.13,0,@黑洲儿 来看！
2022.04.13,0,吱
2022.04.13,0,太快乐了[呲牙]
2022.04.13,0,好喜欢生机勃勃的亚子
2022.04.13,0,https://www.bilibili.com/video/BV1dY4y1e7XG?spm_id_from=333.999.0.0
2022.04.13,0,可以可以
2022.04.13,0,真的好快乐，好有感染力
2022.04.13,0,为什么不利用这个时间读书[疑惑][疑惑][疑惑][疑惑][疑惑]
2022.04.13,0,我也想试试一群人在学校穿着皮套玩[滑稽]
2022.04.13,0,本校：快乐麻将行为 谁懂 哈哈哈哈哈
2022.04.13,0,打团不带剑，但是带了龙
2022.04.13,0,@春日青cccc 笑拉了
2022.04.13,0,爽诶！
2022.04.13,0,乐，乐死了
2022.04.13,0,这不是我们学校的吗[笑哭]
2022.04.13,0,谢谢，久违了让我开心了一下
2022.04.13,0,[热词系列_知识增加]
2022.04.13,0,如果没有疫情，确实会是这样
2022.04.13,0,果然无论什么年龄都爱广场舞吗[脱单doge]
